{
  "$schema": "http://json-schema.org/draft-04/schema#",
  "definitions": {},
  "id": "http://example.com/example.json",
  "properties": {
    "program_identifier": {
      "enum": [
        "california_first",
        "renew_pace_florida"
      ]
    },
    "document_set_name": {
      "enum": [
        "completion_documents",
        "financing_documents"
      ]
    },
    "documents": {
      "items": {
        "properties": {
          "name": { "type": "string" },
          "data": { "type": "string" }
        },
        "type": "object",
        "required": [ "name", "data" ]
      },
      "type": "array",
      "minItems": 1
    },
    "recipients": {
      "items": {
        "properties": {
          "client_user_id": { "type": "string" },
          "email": { "type": "string", "format": "email" },
          "id_check": { "type": "boolean" },
          "identifier": { "type": "string" },
          "name": { "type": "string" },
          "recipient_type": { "type": "string" },
          "routing_order": { "type": "string" }
        },
        "type": "object",
        "required": [ "name", "email", "identifier" ]
      },
      "type": "array",
      "minItems": 1
    }
  },
  "required": ["program_identifier", "document_set_name", "documents", "recipients"],
  "type": "object"
}
